{
  "schema_version": "1.0",
  "pack_id": "system-pack-v1-sample-geo-001",
  "geo_materials": [
    {
      "id": "sys-mat-fault-gouge",
      "name": "fault gouge",
      "category": "infill material",
      "description": "Fine, sheared infill in faulted zones with low shear strength.",
      "key_properties": ["soft", "clay-rich", "highly deformable"],
      "engineering_behaviour": ["strength reduction along discontinuities", "sliding susceptibility when wet"],
      "reporting_expressions": ["Fault gouge seam observed along mapped structure."]
    }
  ],
  "geo_features": [
    {
      "id": "sys-feat-detached-block",
      "name": "detached block",
      "category": "instability feature",
      "mechanism": "loss of confinement across intersecting joints",
      "description": "Block with visible separation from host rock and release potential.",
      "typical_conditions": ["jointed crown", "blast-damaged perimeter", "daylighting structure"],
      "field_indicators": ["open perimeter crack", "hollow response on scaling bar", "fresh rock face at margins"],
      "engineering_assessment": ["assess release path", "assess trigger conditions", "assess support interaction"],
      "reporting_expressions": ["Detached block with open perimeter crack observed in crown."]
    }
  ],
  "strategies": [
    {
      "id": "sys-strat-hand-scaling",
      "name": "hand scaling",
      "category": "immediate treatment",
      "trigger_conditions": ["localized loose rock", "confirmed detached block"],
      "actions": ["isolate area", "scale unstable material", "recheck perimeter discontinuities"],
      "reporting_expressions": ["Hand scaling completed for identified loose material."]
    }
  ]
}
